{
	"$schema": "http://json-schema.org/draft-07/schema#",
	"type": "object",
	"properties": {
		"name": {
			"$ref": "#/definitions/name"
		},
		"revision": {
			"type": "string",
			"pattern": "^\\d*\\.\\d*\\.\\d*$"
		},
		"description": {
			"type": "string"
		},
		"properties": {
			"$ref": "#/definitions/typeObject"
		},
		"events": {
			"type": "object",
			"additionalProperties": {
				"$ref": "#/definitions/eventDescription"
			}
		},
		"operations": {
			"type": "object",
			"propertyNames": {
				"pattern": "^[A-Za-z_][A-Za-z0-9_.]*$"
			},
			"additionalProperties": {
				"$ref": "#/definitions/operationDescription"
			}
		}
	},
	"required": [
		"name",
		"revision"
	],
	"definitions": {
		"name": {
			"type": "string",
			"pattern": "^[A-Za-z_][A-Za-z0-9_]*$",
			"minLength": 3
		},
		"simpleTypes": {
			"enum": [
				"array",
				"boolean",
				"integer",
				"null",
				"number",
				"object",
				"string"
			]
		},
		"eventDescription": {
			"type": "object",
			"properties": {
				"description": {
					"type": "string"
				},
				"parameters": {
					"$ref": "#/definitions/typeObject"
				}
			}
		},
		"operationDescription": {
			"allOf": [
				{
					"$ref": "#/definitions/eventDescription"
				},
				{
					"properties": {
						"response": {
							"$ref": "#/definitions/typeDescription"
						}
					}
				}
			]
		},
		"typeDescription": {
			"type": "object",
			"properties": {
				"description": {
					"type": "string"
				},
				"type": {
					"$ref": "#/definitions/simpleTypes"
				}
			},
			"required": [
				"type"
			]
		},
		"typeObject": {
			"type": "object",
			"propertyNames": {
				"pattern": "^[A-Za-z_][A-Za-z0-9_.]*$"
			},
			"additionalProperties": {
				"$ref": "#/definitions/typeDescription"
			}
		}
	}
}